{
  "profile": "five-forces@1",
  "title": "ファイブフォース分析",
  "description": "業界の収益構造を5つの力で分析し、取るべきポジションを導く。",
  "genTargets": [
    "summary.html"
  ],
  "framework": {
    "sections": [
      {
        "key": "rivalry",
        "title": "業界内の競争",
        "description": "既存競合間の競争の激しさ",
        "needs": [
          "競合の数と規模",
          "差別化の度合い・価格競争の状況"
        ]
      },
      {
        "key": "new-entrants",
        "title": "新規参入の脅威",
        "description": "参入障壁の高さと新規参入の可能性",
        "needs": [
          "参入障壁（資本・規制・技術・ブランド）",
          "最近の新規参入者"
        ]
      },
      {
        "key": "substitutes",
        "title": "代替品の脅威",
        "description": "同じニーズを満たす別手段の存在",
        "needs": [
          "顧客が代わりに使える手段",
          "代替品への乗換コスト"
        ]
      },
      {
        "key": "buyers",
        "title": "買い手の交渉力",
        "description": "顧客側の価格・条件交渉力",
        "needs": [
          "顧客の集中度・購買量",
          "乗換コスト・価格感度"
        ]
      },
      {
        "key": "suppliers",
        "title": "売り手の交渉力",
        "description": "供給側の価格・条件交渉力",
        "needs": [
          "主要な仕入先・依存度",
          "供給の代替可能性"
        ]
      }
    ],
    "prompt": "各フォースの強弱（強/中/弱）と根拠を示し、最後に業界の収益性の結論と、自社が取るべきポジション・打ち手を rivalry の items 末尾に「結論:」として必ず入れる。"
  }
}
