{
  "profile": "stp@1",
  "title": "STP 分析",
  "description": "セグメンテーション→ターゲティング→ポジショニングで狙う市場と立ち位置を決める。",
  "genTargets": [
    "summary.html"
  ],
  "framework": {
    "sections": [
      {
        "key": "segmentation",
        "title": "セグメンテーション",
        "description": "市場を意味のある軸で分割する",
        "needs": [
          "市場の分割軸（属性・ニーズ・行動）",
          "各セグメントの規模感"
        ]
      },
      {
        "key": "targeting",
        "title": "ターゲティング",
        "description": "狙うセグメントの選定と根拠",
        "needs": [
          "各セグメントの魅力度（規模・成長・競合状況）",
          "自社適合度"
        ]
      },
      {
        "key": "positioning",
        "title": "ポジショニング",
        "description": "ターゲットの頭の中での独自の立ち位置",
        "needs": [
          "競合との差別化要素",
          "顧客が重視する購買決定要因"
        ]
      }
    ],
    "prompt": "セグメントは分割軸を明示する。ターゲット選定は市場性×自社適合度の根拠を付ける。ポジショニングは差別化2軸を明示し、競合の位置と自社の位置を対比する。"
  }
}
