{
  "profile": "swot@1",
  "title": "SWOT 分析",
  "description": "強み/弱み/機会/脅威の4象限フレームワーク。内部要因 (S/W) × 外部要因 (O/T)。各象限の子ノードとして項目を追加し、根拠 (evidence) と影響度 (impact) を fields に持たせる。根拠は ResearchDoc 参照可。",
  "nodeTypes": {
    "swot.strength": {
      "title": "強み (Strength)",
      "description": "内部・プラス要因。自社が持つ優位性。",
      "fields": {
        "type": "object",
        "additionalProperties": false,
        "properties": {
          "evidence": {
            "type": "string",
            "description": "根拠・出典（ResearchDoc id / URL 可）"
          },
          "impact": {
            "type": "integer",
            "minimum": 1,
            "maximum": 5,
            "description": "影響度 1〜5"
          },
          "source": {
            "type": "string",
            "description": "情報源（URL / ResearchDoc id）"
          }
        }
      },
      "x-a2-complete-when": [
        "evidence"
      ]
    },
    "swot.weakness": {
      "title": "弱み (Weakness)",
      "description": "内部・マイナス要因。自社の劣位・不足。",
      "fields": {
        "type": "object",
        "additionalProperties": false,
        "properties": {
          "evidence": {
            "type": "string",
            "description": "根拠・出典（ResearchDoc id / URL 可）"
          },
          "impact": {
            "type": "integer",
            "minimum": 1,
            "maximum": 5,
            "description": "影響度 1〜5"
          },
          "source": {
            "type": "string",
            "description": "情報源（URL / ResearchDoc id）"
          }
        }
      },
      "x-a2-complete-when": [
        "evidence"
      ]
    },
    "swot.opportunity": {
      "title": "機会 (Opportunity)",
      "description": "外部・プラス要因。市場・環境の追い風。",
      "fields": {
        "type": "object",
        "additionalProperties": false,
        "properties": {
          "evidence": {
            "type": "string",
            "description": "根拠・出典（ResearchDoc id / URL 可）"
          },
          "impact": {
            "type": "integer",
            "minimum": 1,
            "maximum": 5,
            "description": "影響度 1〜5"
          },
          "source": {
            "type": "string",
            "description": "情報源（URL / ResearchDoc id）"
          }
        }
      },
      "x-a2-complete-when": [
        "evidence"
      ]
    },
    "swot.threat": {
      "title": "脅威 (Threat)",
      "description": "外部・マイナス要因。市場・環境の逆風。",
      "fields": {
        "type": "object",
        "additionalProperties": false,
        "properties": {
          "evidence": {
            "type": "string",
            "description": "根拠・出典（ResearchDoc id / URL 可）"
          },
          "impact": {
            "type": "integer",
            "minimum": 1,
            "maximum": 5,
            "description": "影響度 1〜5"
          },
          "source": {
            "type": "string",
            "description": "情報源（URL / ResearchDoc id）"
          }
        }
      },
      "x-a2-complete-when": [
        "evidence"
      ]
    }
  },
  "template": [
    {
      "text": "強み (S)",
      "type": "swot.strength",
      "children": [
        {
          "text": "（強みを追加）",
          "type": "swot.strength"
        }
      ]
    },
    {
      "text": "弱み (W)",
      "type": "swot.weakness",
      "children": [
        {
          "text": "（弱みを追加）",
          "type": "swot.weakness"
        }
      ]
    },
    {
      "text": "機会 (O)",
      "type": "swot.opportunity",
      "children": [
        {
          "text": "（機会を追加）",
          "type": "swot.opportunity"
        }
      ]
    },
    {
      "text": "脅威 (T)",
      "type": "swot.threat",
      "children": [
        {
          "text": "（脅威を追加）",
          "type": "swot.threat"
        }
      ]
    }
  ],
  "genTargets": [
    "summary.html",
    "biz-plan.docx"
  ],
  "framework": {
    "sections": [
      {
        "key": "strength",
        "title": "強み (Strength)",
        "description": "内部要因: 他社に勝る点・実績・資産",
        "needs": [
          "他社に勝る点・実績",
          "独自の資産・技術・チャネル"
        ]
      },
      {
        "key": "weakness",
        "title": "弱み (Weakness)",
        "description": "内部要因: 劣る点・不足している資源",
        "needs": [
          "競合に劣る点",
          "不足している資源・能力"
        ]
      },
      {
        "key": "opportunity",
        "title": "機会 (Opportunity)",
        "description": "外部要因: 市場・環境の追い風",
        "needs": [
          "市場の成長・変化",
          "規制・技術・社会の追い風"
        ]
      },
      {
        "key": "threat",
        "title": "脅威 (Threat)",
        "description": "外部要因: 競合・規制・環境の逆風",
        "needs": [
          "競合の動き",
          "規制・代替品・環境の逆風"
        ]
      },
      {
        "key": "cross",
        "title": "クロスSWOT戦略",
        "description": "SO/WO/ST/WT の掛け合わせから導く具体戦略"
      }
    ],
    "prompt": "内部要因(S/W)と外部要因(O/T)を峻別する。cross では SO(強み×機会で攻める)/WO(弱みを補って機会を掴む)/ST(強みで脅威を回避)/WT(防衛・撤退)の順に具体的な戦略を出す。"
  }
}
