{
  "profile": "vpc@1",
  "title": "バリュープロポジションキャンバス",
  "description": "顧客プロフィールと価値マップの適合(Fit)を検証する。",
  "genTargets": [
    "summary.html"
  ],
  "framework": {
    "sections": [
      {
        "key": "customer-profile",
        "title": "顧客プロフィール",
        "description": "顧客のジョブ（用事）・ペイン（悩み）・ゲイン（望む成果）",
        "needs": [
          "顧客が片付けたい用事(ジョブ)",
          "顧客の悩み・障害(ペイン)",
          "顧客が望む成果(ゲイン)"
        ]
      },
      {
        "key": "value-map",
        "title": "価値マップ",
        "description": "製品・サービス／ペインリリーバー／ゲインクリエイター",
        "needs": [
          "提供する製品・サービス",
          "どの悩みをどう取り除くか",
          "どの成果をどう生むか"
        ]
      },
      {
        "key": "fit",
        "title": "適合 (Fit) の検証",
        "description": "ペイン・ゲインと提供価値の1対1対応の検証"
      }
    ],
    "prompt": "顧客プロフィール→価値マップの順に作り、fit ではペイン/ゲインの各項目に対応する提供価値を1対1で突き合わせ、対応が無い項目を明示する。"
  }
}
